available_since,company,job_description,job_title,location
30+ days ago,Merah Cipta Media,"Responsibilities
,Are you interested in building better products based on data? We makes decision by looking at the data, hence we value data. As data science engineer, you will get to work on some engineering-related tasks like building API in a TDD fashion, and some data science-related tasks like classifications, clustering, etc. There are 2 kinds of code that we write: ,scripting, code and ,production-level, code. For scripting, we write scripts just to get the job done. For production-level code, we need it to be production-ready, meaning no slow-performing codes are allowed. ,What you will do:,
,Bunch of classifiers,
,Clustering,
,Newsfeed scoring (incl., recommender engine),
,Requirements
,Believe in our values: ,Get job done, Be Bold, Stay Curious, Excellence, Collaboration,
,Knowledge in computer-science is a must,
,Have a foundation on machine learning concepts and algorithms (text-related is preferred),
,Able to scrape website for gathering training data, and clean them up,
,Able to do queries (SQL and NoSQL),
,Able to code in Python (knowing Golang is a plus),
,Familiar with Git,
,Knowledge on containerized-solutions (docker, kubernetes) is a bonus,
,Preferred qualifications:,
,Experienced on software architecture,
,Experienced on production-level machine learning systems,
,Familiar with devops function",Data Science Engineer,Jakarta
15 days ago,Aplikas Servis Pesona,"Architecture and design of technical solutions regarding Data Loss Prevention (DLP).
,
Develop secure system solutions to meet DLP program requirements.
,
Documentation of systems designs and configurations of architected solutions; this may include conceptual, logical, and physical diagrams; new environment design documents; write-ups on technical capabilities and solution configurations; etc.
,
Following up and working with internal IT teams to ensure solutions are built, deployed, and modified as necessary according to the project
,General Requirements;
,
Candidate must possess at least a Bachelors Degree in Informatics Engineering / Informatics System
,
Fluent in English (Reading, Writing, and Speaking)
,
Analytical and process-oriented mindset
,
Enthusiastic and creative team player with the ability to inspire others
,
Technical Requirements;
,
Proven experience regarding front-end architecture and design of technical solutions in the DLP space (is more preference).
,
1 Year of DLP operational experience is required, must have implemented DLP, understanding expressions, analysis, policy drivers, and rules work, etc.
,
Having knowledge about network security technologies including; Proxies, NG Firewalls, SSL/IPSec, VPN’s, SSO, DLP, and Encryption gateways.
,
Demonstrable experience with systems installation, configuration, and administration of UNIX/Linux and Windows-based systems (prior Active Directory/LDAP experience desirable).
,
Expert in troubleshooting various scenarios and systems by using knowledge of common tools (tcp dump) and protocols (TCP/IP, NTP, DNS, DHCP).",Data Loss Prevention (DLP) Engineer,Jakarta
18 days ago,PT Bumi Amartha Teknologi Mandiri,"We are looking for an experienced data engineer to join our team.
,
To succeed in this data engineering position, you should have strong analytical skills and the ability to combine data from different sources
,Microsoft SSIS, MS SQL and Postgre (Database) , PL/SQL Stored Procedured are mandatory skill.
,
Understand code base solution, repository management, and branching strategy using Bitbucket.
,
Familiar using JIRA, Confluence.
,
Experience in delivery using agile approach / scrum.
,
Devops for automatic deployment using Jenkins .
,
Familiar with Azure ETL product like Azure Data Factory, Azure Synapse, Azure Datalake, Azure Devops.
,
Familiar using Batching Tools like Control-M.
,
Devops, Code Repository, Azure are optional but willing to learn",Data Engineer,Jakarta
23 days ago,PT. Warung Pintar,"Responsibilities,Handling End-to-end Data Pipelines from heterogeneous input to Data Warehouse, serving various multiple teams for analytical purposes,Become a data architect by implementing Data Modelling concepts based on data warehouse modelling best practices,Responsible for managing a reliable Single Version of Truth and turning data into critical information and knowledge that can be used to make sound business resolutions,Define clear and well-scoped requirements documents, including specs and workflows, that is easily understood by technical and non-technical audiences,Work with Product Managers, Engineers, Data Analytics and various other teams to ship data warehouse features, updates, and data product improvements,Requirements,2 years of experience in Data Analytics field (Analyst or Engineer),Fluent in Python and advanced SQL,Expert in Data Warehouse concepts,Experienced in performing data modeling and data quality check,Familiar with Orchestration Tools (eg: Airflow),Familiar with Data Pipeline,Familiar with CI/CD,Familiar with GCP environments,Excellent attention to details,Benefits,Laptop Ownership Program,Communication & Transportation Allowance,Vision Allowance,Maternity Allowance,Insurance with Dental cover and COVID-19 free special coverage,Private Medical/health insurance for employee and family members (spouse up to 3 children),BPJS Allowance (Jaminan Hari Tua, Kesehatan, Jaminan Pensiun, Jaminan Kecelakaan Kerja, Jaminan Kematian,Experience working in a fast-paced industry,Flexible working hours 11 Fun and humble culture that cares about your personal growth,Jenis Pekerjaan: Penuh Waktu",Data Warehouse Engineer (Remote) ($),Jakarta
30+ days ago,McKinsey & Company,"Qualifications,
,Degree in computer science, engineering, mathematics or equivalent experience,
Previous commercial experience in a data-driven role,
Ability to write clean, maintainable and robust code in Python, Scala, Java or similar languages,
Knowledge of software engineering concepts and best practices,
Familiarity with the latest OSS, cloud, container, query and database technologies as well as query languages,
Confirmed experience building data pipelines in production; ability to work across structured, semi-structured and unstructured data,
Experience preparing data for analytics and following a data science workflow,
Commercial client-facing or senior stakeholders management experience,
,Who You'll Work With,
,You will be based in Jakarta and be a part of a global data engineering community. You will work in cross-functional and Agile project teams alongside project managers, data scientists, machine learning engineers, other data engineers and industry experts.,
You will work hand in hand with our clients, from data owners and users to C-level executives.,
Who you are,
You are a highly collaborative individual and enjoy solving problems that focus on adding business value. You have a sense of ownership and enjoy hands-on technical work. Our values resonate with yours.,
,What You'll Do,
,You will work in multi-disciplinary environments harnessing data to provide real-world impact for organisations globally.,
Partner with our clients, from data owners and users to C-level executives, to understand their needs and build impactful analytics solutions,
Design and build data pipelines to support data science projects following software engineering best practices,
Use state of the art technologies to acquire, ingest and transform big datasets,
Map data fields to hypothesis, curate, wrangle and prepare data to be used in advanced analytics models,
Create and manage data environments in the cloud or on premise,
Ensure information security standards are maintained at all time,
Contribute to cross-functional problem-solving sessions with your team and deliver presentations to colleagues and clients,
Be flexible to travel to our clients' offices to deliver presentations, gather information or share knowledge,
Have the opportunity to contribute to R&D and internal asset development projects,
Our tech stack,
While we advocate for using the right tech for the right task, we often leverage the following technologies: Python, PySpark, SQL, Airflow, Databricks, our own OSS called Kedro, container technologies such as Docker and Kubernetes, cloud solutions such as AWS, GCP or Azure, and more!,
What you'll benefit from,
Real-World Impact, – No project is ever the same. We work with top-tier clients across multiple sectors, providing unique learning and development opportunities internationally.,
Fusing Tech & Leadership, – We work with the latest technologies and methodologies and offer first class learning programmes at all levels.,
Multidisciplinary Teamwork, - Our teams include data scientists, engineers, project managers, UX and visual designers who work collaboratively to enhance performance.,
Innovative Work Culture, – Creativity, insight and passion come from being balanced. We cultivate a modern work environment through an emphasis on wellness, insightful talks and training sessions.,
Striving for Diversity, – With colleagues from over 40 nationalities, we recognise the benefits of working with people from all walks of life.,
Visit our ,Careers site, to watch our video and read about our interview processes and benefits.",Data Engineer - QuantumBlack,Jakarta
30+ days ago,byOrange,"Company Description,
Orange provides your personalized go-to pool of strategy planners, creatives, and technologists for your brand and campaign that aren't part of your daily routine. Strategic managers, content specialists, conceptual creatives, producers, SEO experts, product managers, and others are among the impact players who are held match-fit for your brand.,
Job Description,
Design and build highly scalable pipeline (end-to-end) for large volumes of complex data processing and analysis,
Build and develop large data warehouses, high performance data processing pipelines, and ETL tools,
Ensure high data integrity and quality from various data sources,
Design and implement process improvements, build automated processes, optimize data delivery and re-designing infrastructure for larger scalability,
Work with machine learning systems in production,
Understanding of software design principles and best practices (test driven development, source control management etc.),
Able to clearly articulate pros and cons of different technologies, solutions and platforms,
Able to document use cases, solutions and recommendations,
Qualifications,
Solid experience and knowledge on Google Cloud Platform (or any of the major cloud solution providers such as AWS, Azure, AliCloud) for data management: Composer, Pubsub, Google Storage, Dataflow, Big Query and Data Fusion, or equivalent,
Savvy with Airflow, or a diverse set of data technologies: Redshift, Elastic Search, PostgreSQL, Spark, Hadoop, Kubernetes,
Fluency in Python, SQL, Java or equivalent,
Understanding of SQL & NoSQL databases and other manipulation tools,
Ability to work with stream-processing systems: Storm, Spark-streaming, etc.,
Able to benchmark systems, analyse performance and bottlenecks and propose solutions to resolve them,
Excellent written and verbal communication, able to switch between technical and plain language when discussing work,
Able to work in teams, understand and empathize with all major stakeholders, take the lead on initiatives and direct and manage data engineers,
Able to work in a fast-paced agile development environment,
,5Sca1XxBm0",Senior Data Engineer,Jakarta
30+ days ago,FinAccel,"Job Responsibility:,
,Develop and implement Machine Learning pipeline infrastructure, including but not limited to: ETL (Extract, Transform and Load) of raw data into model features and building platform to automate ML training, testing and maintenance.,Partnering with Data Scientists to transform prototypes of predictive models into high performance, well integrated systems.,
,Qualifications:,
,1-2 years (for Junior role) and 3-5 years (for Senior role) of relevant experiences in Software Engineering or Data Engineering,Ability to write robust code in Python,High degree of proficiency with RDBMS (i.e. MySQL, PostgreSQL) and No-SQL platforms (i.e. S3),Having baseline knowledge of data structures, data modelling and software architecture related to Machine Learning,Strong interest in building scalable and reliable Machine Learning/ AI related services,Past experience working with cloud services platform to build data pipeline, monitoring, scheduler and storage, preferably on AWS environment.,Familiarity using a distributed computing platform, such as Hadoop or Spark is a plus","Software Engineer, Data",Jakarta
30+ days ago,Niagaprima Paramitra,"Job Description, :,
,Advance level experience in SQL coding, writing complex OLAP queries,Should participate in system testing, UAT & code migration activities in various environments,Implementation of ETL application, ETL Developer such as: Informatica, IBM Data Stage, Pentaho, Talend,Have experience in Cloudera implementation,
,
,Requirements, :,
,Minimum 2 years in implementation big data or data warehouse,Strong experience in designing, bulding and implementing ETL Jobs,Strong knowledge in database development,Have experience as query developer pl/sql database : oracle, sql server, postgre, etc,Candidate must possess at least a Bachelor’s Degree, Engineering (Computer/Telecommunication) or related in this area,Passionate in learning new technology, capable to solving problem,High initiatives, excellent team work, and customer business oriented,Good communication and interpersonal skill,Can join immediately,
,
,Job Category: ,Technical Consultant
,Job Type: ,Full Time
,Job Location: ,Jakarta",Data Engineer,Jakarta
12 days ago,PT BFI Finance Indonesia Tbk,"Identify internal and external data visualization and reporting needs, in collaboration with the Director, Institutional Research, Communications, and program teams.
,
Fulfill data visualization and reporting needs across the Foundation through the development of intuitive, engaging, insightful, and attractive dashboards and visualizations in Tableau, or other data visualization tools. Kinds of visuals may include information on grant type, organizations, program strategies, grant activities and subjects, grantee locations and activity settings, as well as, grant products or outcomes. Understand the implications of data, and interpret data in context, including identifying trends and outliers.
,
Prepare data visualizations and summarize key takeaways for presentations and reports, including grantmaking visuals presented to the Board and data visualizations for external sources.
,
Clean and organize large datasets, primarily from the Postgresql secondary database, for analysis and visualization; verify and ensure accuracy, integrity, and consistency of data.
,
Collaborate with the Director, Information Technology, and Operations staff to conduct comprehensive reviews of organization-wide data.
,A bachelor's degree in data technology, informatics, science, statistics, or a related field, master's degree preferred.
,
5+ years of professional experience in a research and data visualization environment.
,
Expertise building and creating engaging and effective dashboards and data visualizations with common visualization tools such as Tableau or Power BI.
,
Experience working with multiple data systems, large relational databases, and SQL.
,
Excellent visual skills and experience working with communications and branding professionals.
,
Creative vision, a passion for learning and willingness to adopt and share new ideas.
,
Excellent communication skills, with the ability to work with a wide variety of departments.
,
Ability to manage and coordinate multiple projects and tasks simultaneously, with a careful attention to detail.",Data Visualization Engineer | Pinjam Modal,Tangerang
30+ days ago,J-Express,"Collect data source from Big Data Platform (BDP) for development and reporting.
,
Develop data mart and analytic tools environment, including database structure (tables, views, stored procedure, job scheduler) - which will be used by Data Analyst.
,
Develop data integration and processing (data flow, mapping, transforming and loading) with ETL Engine (SSIS), including troubleshooting.
,
Maintain database parameter and monitor job scheduler.
,
Assist Data Analyst in collecting raw data from Big Data Platform (BDP) in order to complete user’s data request.
,Minimum Bachelor’s degree from any major (Information Technology preferred).
,
Have understanding of T-SQL (SQL Server/MySQL/HQL), including (but not limited to) aggregation, conversion and logical expression.
,
Have prior exposure to various analytic tools such as Power BI/ Tableau/ Metabase.
,
Have prior experience as ETL Developer (minimum 1 year).
,
A team player, eager to learn, organized, and have strong problem solving skill.",Data Engineer,Jakarta
30+ days ago,FinAccel,"FinAccel is a fun, fast-growing company with lofty ambitions. Starting with instant e-commerce financing, we are on a goal to disrupt unsecured lending in Southeast Asia, one of the fastest-growing economic regions globally.
,
Our first product, Kredivo , which integrates at merchant checkout, qualifies e-commerce buyers for instant e-commerce purchase financing at rates which are much lower than consumer finance companies.
,
,As an Data Engineer, you will be excited to:,
Design and develop scalable business data solutions across the entire data supply chain.
,
Create and review technical and user-focused documentation for data solutions (data models, data dictionaries, business glossaries, process and data flows, architecture diagrams, etc.).
,
Solve for complex data integrations across multiple systems.
,
Collaborate with management, business partners, analysts, developers, architects, and engineers to support data quality efforts.
,
,Expertise (can teach/instruct others):, in current data warehousing concepts (using technologies like Redsift, Spark, Hadoop, web services, etc to support business-driven decisioning)
,
SQL and database scripting
,
With data manipulation scripting languages (like Python or Scala)
,
With Data Science toolsets and technology stacks
,A passionate and curious individual in Data Engineering and Analytics subject areas
,
1-5 years of any relevant experiences in Data Engineering, Data Warehouse, Business Intelligence, Analytics
,
Good proficiency in writing SQL, either in RDBMS (i.e. MySQL, PostgreSQL, etc) or OLAP (i.e. BigQuery, Redshift, Oracle, etc.)
,
Ability to write robust and scalable code in Python or other scripting programming language
,
Good knowledge in creating a workable business dashboard.
,
Basic proficiency or experience in infrastructure setup using cloud services (i.e. AWS, GCP, Azure).
,
Strong passion in data engineering or business intelligence areas, ability to search or create solutions.
,
Good communication skills in Bahasa and English. Mostly explaining technical things.
,
Good workable attitude, something we could invest time to develop.",Data Engineer and Analytics,Jakarta
30+ days ago,ZALORA SEA,"In this role, the Data Engineer at ZALORA will be a part of the Data Sciences Innovation Lab. This team serves as the gatekeepers and curators of the BIG data collected into the Data Warehouse/Data Lake from all aspects of our fashion e-commerce business and support data-driven decision-making. He/she will conduct complex data analysis, continuously evolve management reporting, and deliver business insights in an environment of rapid growth and increasing complexity.,
Responsibilities:,
Drive the full lifecycle of Data Science projects: from gathering and understanding the end-user needs to implement a fully automated solution.,
Develop and provision of Data pipelines to enable self-service reports and dashboards.,
Deploy Machine learning techniques to answer the appropriate business problems using R or Python.,
Visualize data using Tableau and create repeatable visual analysis for end users to use as tools.,
Take ownership of the existing BI platforms and maintain the data integrity and accuracy of the numbers and data sources.,
Know Agile - Scrum project management experience/knowledge - Ability to prioritise, pushback and effectively manage a data product and sprint backlog.,
Requirements:,
4+ years of experience in building out scalable and reliable ETL/ELT pipelines and processes to ingest data from a variety of data sources, preferably in the ecommerce retail industry.,
Deep understanding of Relational Database Management Systems (RDBMS) (e.g. PostgreSQL, MySQL) , No-SQL Databases (e.g. MongoDB, ElasticSearch) and hands-on experience in implementation and performance tuning of MPP databases (e.g. Redshift, BigQuery).,
Experience with Tableau, Power BI, Superset or any standard data visualization tools.,
Strong proficiency in writing production-quality code preferable in R/Python, engineering experience with machine learning projects like Time Series Forecasting, Classification and Optimization problems.,
Experience administering and deploying CI/CD tools (e.g. Git, Jira, Jenkins) Industrialization (e.g. Ansible, Terraform), Workflow Management ( e.g. Airflow, Jenkins, Luigi) in Linux operating system environments.,
Exhibits sound business judgment, a proven ability to influence others, strong analytical skills, and a proven track record of taking ownership, leading data-driven analyses, and influencing results.,
Knowledge of cloud services like AWS, GCP, Azure would be a huge added advantage.,
E-commerce / logistics / fashion retail background a bonus.,
The ZALORA Story,
ZALORA is Asia’s leading online fashion, beauty and lifestyle destination, part of Global Fashion Group. As one of the region’s pioneer large scale ecommerce platforms, ZALORA has established a strong presence throughout the region, particularly in Singapore, Indonesia, Malaysia, Brunei, the Philippines, Hong Kong, and in Taiwan, enjoying over 50 million visits per month.,
ZALORA is not obligated to accept resumes from any third parties on behalf of potential candidates for any position (advertised or otherwise) by any means, unless ZALORA has executed a written agreement with such third party and has expressly requested such third party for candidate referrals. Third parties who provide unsolicited resumes of candidate(s) shall waive and forfeit all rights to claim for any placement fees or referral fees in the event that such candidate is eventually engaged or employed by ZALORA or Global Fashion Group.,
,LHDS1CueVi","Data Engineer, Engineering Team",Jakarta
